ID,Dialogue,Cost,LockBy(0 if null),b_Unlock,UpId,UpOpt,DownId,DownOpt,LeftId,LeftOpt,RightId,RightOpt
183,"But I'm glad she did. It really made my life colorful, at least for a while",0,0,0,0,,0,,182,,184,...
184,"Before the band,...I really was miserable. Every day ran into the next, and nothing seemed to breka the neverending river of monotony.",0,0,0,0,,0,,183,,185,...
185,"It wasn't living, or not what I consider it. I worked so that she and I couldn't starve to death, and stopped thinking about much else.",0,0,0,0,,0,,184,,186,...
186,(The girl bites her lower lip) I...I wonder if she knew how I felt. I was close to snapping. I wonder if she knew that?,0,0,0,0,,0,,185,,187,I think she did
187,"(She's quiet for a moment, then smiles. It lights up the booth.) You're probably right. She always could understand how people felt, when she actually gave it time to try.",1,0,0,0,,188,,186,,0,
188,"It would be just like her to try to solve a problem with a dramatic, crazy solution without tellng a soul.",0,0,0,187,,189,...,0,,0,
189,"Oh, god Ai. You're such a precious, silly little idiot...But I'm grateful to you. No one else every went so far to try to make me happy.",-6,0,1,188,,0,,0,,0,
190,I told you. It's not important. It was a very long time ago.,1,121,0,138,,193,Then why do you keep mentioning it?,191,Things we remember that long tend to be important.,0,
191,"Maybe, but I also remember the number 688, and that's not important?",1,0,0,0,,192,688?,0,,190,
192,"My elementary school ID number. Now, it's just a number.",1,0,0,191,,0,,0,,0,
193,"(She sighs, and fidgets with a bracelet around her wrist) Because it's important, Father, just embarassing.",1,0,0,190,,194,"I'm here to forgive, not judge.",0,,0,
194,"Mmm, so you are. Well, ok then. It might surprise you to learn that my childhood wasn't the most happy.",1,0,0,193,,196,...,195,Is that why you and your sister left home so young?,0,
195,"Just so. We both left our homes the day after our graduations, and never looked back, no matter how bad things god.",1,0,0,0,,0,,0,,194,
196,"Our parents were strict, small-minded bumpkins. They wanted us to be exactly the same.",-2,0,0,194,,0,,0,,197,And you didn't?
197,"No. No we did not. My sister and I did everything we could to defy them when we were young, because we wanted to be someone -- not just boring old peasants.",1,0,0,0,,198,...,0,,0,
198,"We both earned our fair share of bruises that way, but it was fine. We were together, after all.",0,0,0,197,,199,...,0,,0,
199,"But then things got worse. Our parents were never the perfet couple, but as we got older they started fighting more and more.",0,0,0,198,,200,...,0,,0,
200,Father would often leave home for days at a time. We weren't surprised when they told us they were divorcing. Figured it was better that way.,0,0,0,199,,201,...,0,,0,
201,We were stupid.,0,0,0,200,,0,,0,,202,"They split you up, didn't they?"
202,You're smarter than we were. When they told us...it was as if the world was coming to an end.,1,0,0,0,,203,...,0,,0,
203,"There weren't many children in the village, so we had only had each other our whole ilves. The idea of not even having that...",0,0,0,202,...,204,...,0,,0,
204,It was terrifying. We got desperate. We would have done absolutely anything to stay together.,0,0,0,203,,222,"You really love your sister, don't you?",205,So you fought it?,216,So what ended up happening?
205,Of course we did. I doubt it would surprise you to hear that we did what all imperiled young children do: we ran away together.,1,0,0,206,That is a bit extreme...,207,Did you get away?,0,,204,
206,Not when you're nine! Children live in a different world -- nothing is extreme there. We weren't any different.,1,0,0,0,,205,,0,,0,
207,"For a couple nights. We made it to the neighboring city easily enough, but didn't get much further.",1,0,0,205,,208,...,0,,0,
208,By the third night the police were actively looking for us. We didn't stand a chance. We were too young to be hard to find.,0,0,0,207,,209,So they took you home?,0,,0,
209,Yeah. Shuttled us there by morning Then we got more bruises. They were still worth it.,1,0,0,208,,210,And that's it?,0,,0,
210,"Well, no...",1,0,0,209,,211,...,0,,0,
211,The night they found us was a night unlike any other. I could live for a thousand years and remember it like it was yesterday.,0,0,0,210,,212,...,0,,0,
212,"There was a meteor shower that night, one bigger than any we've seen since. It looked like someone had hit the sky with a great celestial sledgehammer, and now it was all falling to earth a piece at a time.",0,0,0,211,,213,...,0,,0,
213,"We sword that night, beneath that shattered sky and in the back of a patrol car, that we'd find each other once we were graduated and never let each other go again.",0,0,0,212,,214,...,0,,0,
214,"We promised we'd never let each other become the sad husks our parents were, and that we'd always protect each other, no matter the cost.",0,0,0,213,,215,...,0,,0,
215,"Guess we both could be doing a better job, huh?",0,0,1,214,,0,,0,,0,
216,"(She shrugs) They divorced. I moved to the capital with mother, and she only became more a shrew with age.",1,0,0,0,,217,...,204,,0,
217,"My sister stayed with father, who remarried a kind, simple woman, and they're enjoying their kind, simple old age together.",0,0,0,216,,218,...,0,,0,
218,She made friends and played sports in high school. I was absorbed by my studies and my quest to become the student council president.,0,0,0,217,,219,...,0,,0,
219,Then...We gradauated. met up. Moved to the city together. She went to university on a wolleyball scholarship. I faked a degree and got a job programming. We started a band. Fought. Cried. Now we're here.,0,0,0,218,,220,...,0,,0,
220,Could have been better. Might have been worse. But at least we have each other. Everything else doesn't matter.,0,0,0,219,,221,...,0,,0,
221,"(She sighs, for what seems like the hundredth time) Or did, until I screwed it all up.",0,0,1,220,,0,,0,,0,
222,"Huh. Well I guess I do, don't I? Sometimes I can't stand to be around her, but...If I think about my life without her in it...",1,215 221,0,204,,223,,0,,0,
223,It's just not worth living. There's no one more important to me.,0,0,0,222,,224,,0,,0,
224,"Even when she's insensitive, even if she is seducing my love interests....That's all ok.",0,0,0,223,,225,,0,,0,
225,"She's Ai. She's my sister, and I love her. Wev'e been through so much together that I can forgive her anything.",0,0,1,224,,226,,0,,0,
226,"Though, if he doesn't explain himself soon, there'll be one drummer who'll wish he's never been born.",0,0,0,225,,227,"Shuold I expect to see you again soon, then?",0,,0,
227,No. I won't feel guilty at all about clocking that clueless man's head off.,1,0,0,226,,0,,0,,0,
228,I mean that a good leader should be in control of a situation enough that you'd never need to do something so drastic. My sister is...rarely in control of much.,-2,0,0,0,,0,,61,,0,
229,"That is what I said, yes. And a fine one too, if I do say so myself.",-3,0,0,0,,0,,152,,0,
230,CONGRATULATIONS (clapping noises),0,136 171 189 225,0,0,,0,,35,,0,